udp,question,answer
1,"Hello, Tactica",How would you like to begin today? 
2,Zoom into the UAE.,"Sure, Zooming into The United Arab Emirates. The UAE is a country located in the Arabian Peninsula. It is a federal, elective monarchy composed of seven emirates, with Abu Dhabi as its capital."
3,What are the commercial ports in the UAE?,"The UAE has twelve commercial ports, along with several smaller ports and specialized facilities. Of these, seven ports are considered major due to their strategic importance and high capacity for handling cargo, containers, and passengers. These are Jabel Ali Port, Zayed port, Khalifa Port, Rashid port, Khor Fakkan Port, Fujairah port and Mina Saqr. "
4,Zoom into Khalifa Port Economic Zone,"Sure, here is the latest imagery of Khalifa port and its Economic Zone. There are also thermal and sar imagery available. Would you like to see some of them?"
5,"For the ships currently here, What is their  vessel movement for the last 24 hours?","Here is summary of the vessel movement over the last 24 hours. Within the area, there are total fifty two ships in the area, four ships with AIS deactivated, and thirty three are currently docked"
6,Zoom into the port itself,"Zooming into Khalifa Port, Khalifa Port is a state-of-the-art deepwater port and one of the region’s largest logistics hubs. It handles containerized, bulk, and general cargo, connecting global markets with advanced automation and infrastructure."
7,Enhance the optical imagery and detect all ships,Imagery enhanced. There are currently 33 ships docked at the port.
8,What assets are in the port?,"Key assets detected in the port, include 36 STS cranes, and 98 other types of cranes including yard . The port currently holds approximately sixty three thousand containers."
9,How many staff and visitors are within the port area?  ,"Here is a density heat map. There are 741 people in the port area. Of these, 318 are employees, and 423 are visitors."
10,What is the water depth in the port area?,The water depth varies from 10 to 19 meters across the port. There is a 3 meter increase in depth near the eastern entrance due to recent dredging.
11,Provide a 3D visualization of the port's underwater topography,Certainly. Here is the 3D visualization of the underwater topography. Areas with recent changes are highlighted in blue.
12,"Yes, get the image",Acknowledged. Communicating with the Satellite; Data is being requested 
13,What is the latest known information about this ship?,"The ship is a chemical tanker known as MT Stolt Sakura. This ship is a Chemical Oil Products tanker. It has a length of 122 meters and beam of 22 meters. The ships recent available imagery are sar imagery detected 78 minutes ago as shown. As of 37 minutes ago, Thermal and AIS data confirm its location at the specified location at a speed of 11.4 knots and with a heading bearing 17 degrees. The Area to be searched is displayed."
14,What is the trajectory of this ship?,The ship overall trajectory over is shown here. The ships route is originating from Mombasa Harbour heading to Umm Qasr Port. Notification received. The new imagery is ready to be visualized
15,"Open and analyse the new image
Detect and identify the ships new location and any other suspected activity of the ship","Based on the new image, I have identified the location of the MT Stolt Sakura.  It is observed that the MT Stolt Sakura is engaging in an offshore-trans-shipment with a general cargo ship. The second ship has been identified as the MV Arklow Meadow general cargo ship. A 3D reconstructed model of the two vessels is presented."
16,Generate a report on these two ships and send it to Khalid,"A report is currently being generated. The report will be sent to Khalid both in PDF format and through his access in the Platform.
Would you like to increase coverage for this area and detected ships?"
17,Yes. Also open the report.,"Monitoring coverage has been increased. Here is the generated report, which includes snapshots of both ships  routes, historical activities, trade information, and projected movements."
18,Close the report.,The report is closed and disseminated. Is there anything else you would like me to assist with?
19,"Yes,  Lets look at the urban areas of Abu Dhabi, Zoom into Khalifa City and do land cover classification.","Certainly. Zooming into Khalifa City. Here is a land coverage classification of it showing buildings, roads, solar panel and agricultural lands. "
20,What are the newly constructed buildings in Khalifa City in 2024?,"Comparing August 2024 to  August 2023, the newly constructed buildings are highlighted in green. "
21,How many vehicles are in the imagery in this area?,"Based on this image, there are approximately ten thousand eight hundrend and one vehicles detected in the area."
22,Identify all palm trees in the region and surrounding main roads.,"Sure, there are detected six thousand one hundred and seventy three palm trees in the area as highlighted. Good percentage of the palm trees are concentrate on the surrounding main roads."
23,Run red weevil analysis on the palm trees.,Here is a breakdown of palm tree health. Approximately 13% are heavily infected with red weevils. The legend on the bottom right indicates the health status of the trees.
24,What is the current traffic density around the region?,"The latest traffic density appears normal. The co lour indicates speed, where orange represents high speeds, while blue shows lower speeds. The thickness of the line reflects the number of cars passing through."
25,Zoom into Zayed airport?,Certainly. Zooming into Zayed International airport. Zayed International Airport serves as a gateway for international passengers and cargo and a major global hub for Etihad Airways. There is also Thermal and sar imagery available. Would you like to see some of them?
26,Identify all airplanes and what is their operational activity.,"As of this image, there are 50 identified airplanes with breakdown of type and confidence score reported. There are 8 airplanes connected to the terminal, 37 parked on and 5 in motion in the taxiway with 1 next to the runway."
27,Identify all A380 airplanes in the airport.,I have detected 4 Airbus A380 airplanes; 1 connected to the terminal and 3 parked on the yard.
28,Zoom into the one connected to the terminal.,Zooming into the Airbus A380 airplane that is connected to the terminal.
29,Run model logic analysis on the airplane.,"Here is a model logic analysis. The dimensions detected are, Length is  69.7 meters, Wingspan is  80.1 meters, TG Height is 22.9 meters,
Number of Engines is 4. Based on the detected dimensions, the confidence level is 97%."
30,Generate a 3D of the Airbus A380,Here is a 3D generated representation of the A380 airplane.
31,Do you have high frequency imagery over the airport?  ,"Yes, there are four optical satellite images taken within the last hour. These are focused on Runway 13R/31L, also known as the western runway, highlighted here in yellow."
32,What are the changes in the western runway over the last 1 hour,"Based on the four images,  we notice the arrival and parking of one airplane And we notice the departure of another plane after disconnecting from the terminal"
33,Put and explain the thermal imagery.,"The Thermal imagery reveals warmer areas like runways, taxiways, and aprons due to heat retention, while cooler zones indicate shaded or vegetated regions. Bright spots near terminals likely represent airplanes or active infrastructure, and the surrounding areas, such as Khalifa City, show mixed heat signatures from residential and industrial zones."
34,Standby,Thanks. I am at standby and will continue to share notifications and alerts.
35,What kind of data can the system support? ,"The system supports the following data, Satellite Imagery including Multispectral, Hyperspectral, sar, and Thermal, It also support and integrate aerial, drones, ground cameras, IoT sensors, AIS, ADSB and OSINT into a unified analytical framework."
36,Open the notification tab,Here are the most recent imagery and data updated into the system.